{
  "$schema": "https://json-schema.org/draft/2020-12/schema",
  "$id": "https://local-pii.dev/schemas/cli/cli-report/1.0.0",
  "title": "CLI operation report",
  "description": "Privacy-minimized machine output for local scan, redact, verify, and inspect commands.",
  "schemaVersion": "1.0.0",
  "type": "object",
  "additionalProperties": false,
  "required": ["schemaVersion", "operation", "outcome"],
  "properties": {
    "schemaVersion": { "const": "1.0.0" },
    "operation": { "enum": ["SCAN", "REDACT", "VERIFY", "INSPECT"] },
    "outcome": { "enum": ["SUCCEEDED", "NEEDS_REVIEW", "VERIFIED", "PASS", "FAIL"] },
    "input": { "$ref": "#/$defs/artifactSummary" },
    "output": { "$ref": "#/$defs/artifactSummary" },
    "artifact": { "$ref": "#/$defs/artifactSummary" },
    "policy": { "$ref": "#/$defs/policySummary" },
    "detectorBundleVersion": { "type": "string", "minLength": 1, "maxLength": 100 },
    "counts": {
      "type": "object", "additionalProperties": false, "required": ["detections", "conflicts", "byEntity"],
      "properties": {
        "detections": { "type": "integer", "minimum": 0 }, "conflicts": { "type": "integer", "minimum": 0 },
        "byEntity": { "type": "object", "propertyNames": { "$ref": "https://local-pii.dev/schemas/common/entity-type/1.0.0" }, "additionalProperties": { "type": "integer", "minimum": 1 } }
      }
    },
    "detections": {
      "type": "array", "maxItems": 10000,
      "items": {
        "type": "object", "additionalProperties": false, "required": ["id", "entityType", "start", "end", "confidence", "evidenceIds"],
        "properties": {
          "id": { "type": "string", "pattern": "^rsp_[a-f0-9]{32}$" }, "entityType": { "$ref": "https://local-pii.dev/schemas/common/entity-type/1.0.0" },
          "start": { "type": "integer", "minimum": 0 }, "end": { "type": "integer", "minimum": 1 }, "confidence": { "type": "number", "minimum": 0, "maximum": 1 },
          "evidenceIds": { "type": "array", "minItems": 1, "items": { "type": "string", "format": "uuid" }, "uniqueItems": true }
        }
      }
    },
    "conflicts": {
      "type": "array", "maxItems": 10000,
      "items": {
        "type": "object", "additionalProperties": false, "required": ["code", "evidenceIds", "start", "end"],
        "properties": {
          "code": { "const": "INCOMPATIBLE_OVERLAP" }, "evidenceIds": { "type": "array", "minItems": 2, "items": { "type": "string", "format": "uuid" }, "uniqueItems": true },
          "start": { "type": "integer", "minimum": 0 }, "end": { "type": "integer", "minimum": 1 }
        }
      }
    },
    "plan": {
      "type": "object", "additionalProperties": false,
      "required": [
        "id", "digest", "inputDigest", "extractionRevision", "resolutionDigest", "capabilityDigest",
        "policyDigest", "detectorBundleVersion", "writer", "strategy", "strategyVersion",
        "actionCount", "byEntity"
      ],
      "properties": {
        "id": { "type": "string", "pattern": "^plan_[0-9A-HJKMNP-TV-Z]{26}$" },
        "digest": { "$ref": "https://local-pii.dev/schemas/common/identifiers/1.0.0#/$defs/Digest" },
        "inputDigest": { "$ref": "https://local-pii.dev/schemas/common/identifiers/1.0.0#/$defs/Digest" },
        "extractionRevision": { "$ref": "https://local-pii.dev/schemas/common/identifiers/1.0.0#/$defs/Digest" },
        "resolutionDigest": { "$ref": "https://local-pii.dev/schemas/common/identifiers/1.0.0#/$defs/Digest" },
        "capabilityDigest": { "$ref": "https://local-pii.dev/schemas/common/identifiers/1.0.0#/$defs/Digest" },
        "policyDigest": { "$ref": "https://local-pii.dev/schemas/common/identifiers/1.0.0#/$defs/Digest" },
        "detectorBundleVersion": { "type": "string", "minLength": 1, "maxLength": 100 },
        "writer": {
          "type": "object", "additionalProperties": false, "required": ["id", "version"],
          "properties": {
            "id": { "type": "string", "pattern": "^[a-z][a-z0-9-]{2,63}$" },
            "version": { "$ref": "https://local-pii.dev/schemas/common/identifiers/1.0.0#/$defs/Semver" }
          }
        },
        "strategy": { "const": "TYPED_LABEL" },
        "strategyVersion": { "$ref": "https://local-pii.dev/schemas/common/identifiers/1.0.0#/$defs/Semver" },
        "actionCount": { "type": "integer", "minimum": 0 },
        "byEntity": { "type": "object", "propertyNames": { "$ref": "https://local-pii.dev/schemas/common/entity-type/1.0.0" }, "additionalProperties": { "type": "integer", "minimum": 1 } }
      }
    },
    "writerReceipt": { "$ref": "#/$defs/writerReceiptSummary" },
    "verification": { "$ref": "#/$defs/verification" },
    "capability": {
      "type": "object", "additionalProperties": false, "required": ["adapter", "version", "operations"],
      "properties": {
        "adapter": { "enum": ["text", "json"] }, "version": { "$ref": "https://local-pii.dev/schemas/common/identifiers/1.0.0#/$defs/Semver" },
        "operations": { "type": "array", "items": { "enum": ["SCAN", "REDACT", "VERIFY", "INSPECT"] }, "uniqueItems": true }
      }
    }
  },
  "$defs": {
    "policySummary": {
      "type": "object", "additionalProperties": false, "required": ["id", "version", "digest", "riskTier", "example"],
      "properties": {
        "id": { "type": "string", "pattern": "^[a-z][a-z0-9-]{2,63}$" },
        "version": { "$ref": "https://local-pii.dev/schemas/common/identifiers/1.0.0#/$defs/Semver" },
        "digest": { "$ref": "https://local-pii.dev/schemas/common/identifiers/1.0.0#/$defs/Digest" },
        "riskTier": { "enum": ["LOW", "MODERATE", "HIGH"] },
        "example": { "const": true }
      }
    },
    "artifactSummary": {
      "type": "object", "additionalProperties": false, "required": ["byteLength", "digest"],
      "properties": {
        "displayName": { "type": "string", "minLength": 1, "maxLength": 255 },
        "mediaType": { "enum": ["text/plain", "text/markdown", "application/json"] }, "byteLength": { "type": "integer", "minimum": 0 },
        "digest": { "$ref": "https://local-pii.dev/schemas/common/identifiers/1.0.0#/$defs/Digest" },
        "extractionRevision": { "$ref": "https://local-pii.dev/schemas/common/identifiers/1.0.0#/$defs/Digest" },
        "unicodeCodePoints": { "type": "integer", "minimum": 0 }, "hasUtf8Bom": { "type": "boolean" }
      }
    },
    "writerReceiptSummary": {
      "type": "object", "additionalProperties": false,
      "required": [
        "receiptDigest", "planDigest", "outputDigest", "writer",
        "expectedActionCount", "appliedActionCount"
      ],
      "properties": {
        "receiptDigest": { "$ref": "https://local-pii.dev/schemas/common/identifiers/1.0.0#/$defs/Digest" },
        "planDigest": { "$ref": "https://local-pii.dev/schemas/common/identifiers/1.0.0#/$defs/Digest" },
        "outputDigest": { "$ref": "https://local-pii.dev/schemas/common/identifiers/1.0.0#/$defs/Digest" },
        "writer": {
          "type": "object", "additionalProperties": false, "required": ["id", "version"],
          "properties": {
            "id": { "type": "string", "pattern": "^[a-z][a-z0-9-]{2,63}$" },
            "version": { "$ref": "https://local-pii.dev/schemas/common/identifiers/1.0.0#/$defs/Semver" }
          }
        },
        "expectedActionCount": { "type": "integer", "minimum": 0, "maximum": 100000 },
        "appliedActionCount": { "type": "integer", "minimum": 0, "maximum": 100000 }
      }
    },
    "verification": {
      "type": "object", "additionalProperties": false, "required": ["schemaVersion", "profile", "outcome", "detectorBundleVersion", "checks", "findings"],
      "properties": {
        "schemaVersion": { "const": "1.0.0" }, "profile": { "const": "text-rescan-v1" }, "outcome": { "enum": ["PASS", "FAIL"] }, "detectorBundleVersion": { "type": "string", "minLength": 1 },
        "checks": { "type": "array", "items": { "enum": ["UTF8_REOPEN", "DETERMINISTIC_RESCAN", "SPAN_RESOLUTION"] }, "minItems": 3, "uniqueItems": true },
        "findings": {
          "type": "array", "maxItems": 10000,
          "items": {
            "type": "object", "additionalProperties": false, "required": ["code", "severity", "blocking"],
            "properties": {
              "code": { "enum": ["RESIDUAL_DETECTION", "SPAN_CONFLICT"] }, "severity": { "const": "ERROR" }, "blocking": { "const": true },
              "entityType": { "$ref": "https://local-pii.dev/schemas/common/entity-type/1.0.0" }, "start": { "type": "integer", "minimum": 0 }, "end": { "type": "integer", "minimum": 1 }
            }
          }
        }
      }
    }
  },
  "allOf": [
    { "if": { "properties": { "operation": { "const": "SCAN" } } }, "then": { "properties": { "input": true, "policy": false, "writerReceipt": false, "detectorBundleVersion": true, "counts": true, "detections": true, "conflicts": true }, "required": ["input", "detectorBundleVersion", "counts", "detections", "conflicts"] } },
    { "if": { "properties": { "operation": { "const": "REDACT" } } }, "then": { "properties": { "input": true, "output": true, "policy": true, "plan": true, "writerReceipt": true, "verification": true }, "required": ["input", "output", "policy", "plan", "writerReceipt", "verification"] } },
    { "if": { "properties": { "operation": { "const": "VERIFY" } } }, "then": { "properties": { "artifact": true, "policy": false, "writerReceipt": false, "verification": true }, "required": ["artifact", "verification"] } },
    { "if": { "properties": { "operation": { "const": "INSPECT" } } }, "then": { "properties": { "artifact": true, "policy": false, "writerReceipt": false, "capability": true }, "required": ["artifact", "capability"] } }
  ],
  "examples": [
    {
      "schemaVersion": "1.0.0", "operation": "SCAN", "outcome": "SUCCEEDED",
      "input": { "displayName": "synthetic.txt", "mediaType": "text/plain", "byteLength": 18, "digest": "sha256:aaaaaaaaaaaaaaaaaaaaaaaaaaaaaaaaaaaaaaaaaaaaaaaaaaaaaaaaaaaaaaaa" },
      "detectorBundleVersion": "0.1.0", "counts": { "detections": 0, "conflicts": 0, "byEntity": {} }, "detections": [], "conflicts": []
    },
    {
      "schemaVersion": "1.0.0", "operation": "REDACT", "outcome": "VERIFIED",
      "input": { "byteLength": 18, "digest": "sha256:aaaaaaaaaaaaaaaaaaaaaaaaaaaaaaaaaaaaaaaaaaaaaaaaaaaaaaaaaaaaaaaa" },
      "output": { "byteLength": 9, "digest": "sha256:bbbbbbbbbbbbbbbbbbbbbbbbbbbbbbbbbbbbbbbbbbbbbbbbbbbbbbbbbbbbbbbb" },
      "policy": { "id": "development-labels", "version": "0.1.0", "digest": "sha256:cccccccccccccccccccccccccccccccccccccccccccccccccccccccccccccccc", "riskTier": "LOW", "example": true },
      "plan": {
        "id": "plan_01J4M8Z7QK2C5B6TFXDA9R4M3V",
        "digest": "sha256:dddddddddddddddddddddddddddddddddddddddddddddddddddddddddddddddd",
        "inputDigest": "sha256:aaaaaaaaaaaaaaaaaaaaaaaaaaaaaaaaaaaaaaaaaaaaaaaaaaaaaaaaaaaaaaaa",
        "extractionRevision": "sha256:bbbbbbbbbbbbbbbbbbbbbbbbbbbbbbbbbbbbbbbbbbbbbbbbbbbbbbbbbbbbbbbb",
        "resolutionDigest": "sha256:eeeeeeeeeeeeeeeeeeeeeeeeeeeeeeeeeeeeeeeeeeeeeeeeeeeeeeeeeeeeeeee",
        "capabilityDigest": "sha256:ffffffffffffffffffffffffffffffffffffffffffffffffffffffffffffffff",
        "policyDigest": "sha256:cccccccccccccccccccccccccccccccccccccccccccccccccccccccccccccccc",
        "detectorBundleVersion": "0.1.0", "writer": { "id": "text-adapter", "version": "0.1.0" },
        "strategy": "TYPED_LABEL", "strategyVersion": "0.1.0", "actionCount": 0, "byEntity": {}
      },
      "writerReceipt": {
        "receiptDigest": "sha256:aaaaaaaaaaaaaaaaaaaaaaaaaaaaaaaaaaaaaaaaaaaaaaaaaaaaaaaaaaaaaaaa",
        "planDigest": "sha256:dddddddddddddddddddddddddddddddddddddddddddddddddddddddddddddddd",
        "outputDigest": "sha256:bbbbbbbbbbbbbbbbbbbbbbbbbbbbbbbbbbbbbbbbbbbbbbbbbbbbbbbbbbbbbbbb",
        "writer": { "id": "text-adapter", "version": "0.1.0" },
        "expectedActionCount": 0,
        "appliedActionCount": 0
      },
      "verification": { "schemaVersion": "1.0.0", "profile": "text-rescan-v1", "outcome": "PASS", "detectorBundleVersion": "0.1.0", "checks": ["UTF8_REOPEN", "DETERMINISTIC_RESCAN", "SPAN_RESOLUTION"], "findings": [] }
    }
  ]
}
