{
  "schemaVersion": "1.0.0",
  "operation": "SCAN",
  "outcome": "SUCCEEDED",
  "input": {
    "displayName": "synthetic.txt",
    "mediaType": "text/plain",
    "byteLength": 18,
    "digest": "sha256:aaaaaaaaaaaaaaaaaaaaaaaaaaaaaaaaaaaaaaaaaaaaaaaaaaaaaaaaaaaaaaaa"
  },
  "detectorBundleVersion": "0.1.0",
  "counts": { "detections": 1, "conflicts": 0, "byEntity": { "EMAIL": 1 } },
  "detections": [{
    "id": "rsp_11111111111141118111111111111111",
    "entityType": "EMAIL",
    "start": 0,
    "end": 18,
    "confidence": 0.99,
    "evidenceIds": ["11111111-1111-4111-8111-111111111111"]
  }],
  "conflicts": []
}
